{"schema":"airvix.flight.index/1","flight_id":"20260923T100000Z-airvix01-0789","vehicle_id":"airvix01","classification":"flight","state":"partial","manifest_rev":3,"arm_utc":"2026-09-23T10:00:00.000Z","takeoff_utc":"2026-09-23T10:00:30.000Z","landed_utc":"2026-09-23T10:09:20.000Z","disarm_utc":"2026-09-23T10:10:00.000Z","time_source":"ntp","duration_s":600,"air_time_s":530,"max_rel_alt_m":70,"max_airspeed_mps":18.4,"max_groundspeed_mps":19.1,"distance_m":9200,"modes":["FBWA","AUTO"],"warnings":1,"errors":0,"critical":0,"end_reason":"disarmed","has_fc_log":false,"artifacts_pending":0,"updated_utc":"2026-09-23T10:14:00.000Z"}