{"schema":"airvix.flight.index/1","flight_id":"20260920T070000Z-airvix01-a1b2","vehicle_id":"airvix01","classification":"flight","state":"complete","manifest_rev":4,"arm_utc":"2026-09-20T07:00:00.000Z","takeoff_utc":"2026-09-20T07:00:42.000Z","landed_utc":"2026-09-20T07:18:20.000Z","disarm_utc":"2026-09-20T07:19:00.000Z","time_source":"ntp","duration_s":1140,"air_time_s":1058,"max_rel_alt_m":121.6,"max_airspeed_mps":22.4,"max_groundspeed_mps":24.1,"distance_m":18420,"modes":["FBWA","AUTO","RTL"],"warnings":3,"errors":0,"critical":0,"end_reason":"disarmed","has_fc_log":true,"artifacts_pending":0,"updated_utc":"2026-09-20T07:22:00.000Z"}