{"schema":"airvix.flight.index/1","flight_id":"20260921T080000Z-airvix01-c3d4","vehicle_id":"airvix01","classification":"flight","state":"awaiting_fc_log","manifest_rev":2,"arm_utc":"2026-09-21T08:00:00.000Z","takeoff_utc":"2026-09-21T08:00:36.000Z","landed_utc":"2026-09-21T08:07:30.000Z","disarm_utc":"2026-09-21T08:08:00.000Z","time_source":"fc_system_time","duration_s":480,"air_time_s":414,"max_rel_alt_m":86,"max_airspeed_mps":20.2,"max_groundspeed_mps":27.4,"distance_m":6400,"modes":["FBWA","RTL"],"warnings":1,"errors":1,"critical":0,"end_reason":"disarmed","has_fc_log":false,"artifacts_pending":1,"updated_utc":"2026-09-21T08:12:00.000Z"}