{"schema":"airvix.flight.index/1","flight_id":"20260922T060000Z-airvix01-e5f6","vehicle_id":"airvix01","classification":"bench","state":"complete","manifest_rev":1,"arm_utc":"2026-09-22T06:00:00.000Z","takeoff_utc":null,"landed_utc":null,"disarm_utc":"2026-09-22T06:03:00.000Z","time_source":"jetson_unsynced","duration_s":180,"air_time_s":0,"max_rel_alt_m":1.6,"max_airspeed_mps":4.2,"max_groundspeed_mps":0.8,"distance_m":6,"modes":["MANUAL"],"warnings":0,"errors":0,"critical":0,"end_reason":"disarmed","has_fc_log":false,"artifacts_pending":0,"updated_utc":"2026-09-22T06:04:00.000Z"}